{
  "$schema": "https://json-schema.org/draft/2020-12/schema",
  "$id": "https://hospitality.local/schemas/policy.schema.json",
  "title": "NormalizedPolicy",
  "description": "Canonical internal representation of a health insurance policy. This is the extraction target: the LLM must emit exactly this shape from raw policy text, and every downstream calculation reads from here.",
  "type": "object",
  "additionalProperties": false,
  "required": [
    "schema_version",
    "policy_id",
    "scheme_type",
    "insurer",
    "coverage",
    "room_rent",
    "icu_rent",
    "co_pay",
    "deductible",
    "sub_limits",
    "waiting_periods",
    "exclusions",
    "network",
    "proportionate_deduction",
    "extraction_meta"
  ],

  "$defs": {
    "confidence": {
      "type": "string",
      "enum": ["high", "medium", "low"],
      "description": "How reliably this value was found in the source document. 'low' means the UI must ask the user to verify before trusting any number derived from it."
    },

    "capLimit": {
      "type": "object",
      "additionalProperties": false,
      "required": ["cap_type", "cap_value", "resolved_per_day", "not_specified", "confidence"],
      "properties": {
        "cap_type": {
          "type": "string",
          "enum": ["absolute_per_day", "percent_of_sum_insured", "category_entitlement", "no_limit"],
          "description": "absolute_per_day: a rupee figure. percent_of_sum_insured: cap_value is the percentage. category_entitlement: no rupee cap, entitlement is by room category (typical of government schemes). no_limit: the policy explicitly places no cap."
        },
        "cap_value": {
          "type": ["number", "null"],
          "minimum": 0,
          "description": "Rupees when cap_type is absolute_per_day; a percentage when percent_of_sum_insured; null otherwise."
        },
        "resolved_per_day": {
          "type": ["number", "null"],
          "minimum": 0,
          "description": "The cap expressed in rupees per day after resolving percentages against sum_insured. null means no rupee cap applies. THIS is the only field the deduction calculator should read."
        },
        "not_specified": {
          "type": "boolean",
          "description": "true when the document is silent on this cap. Silent means NO cap, which is favourable to the patient. Never represent this as 0."
        },
        "eligible_category": {
          "type": ["string", "null"],
          "enum": ["general_ward", "semi_private", "single_private_ac", "deluxe", "icu", null],
          "description": "Highest room category the policy entitles the patient to. Maps onto the room_tariff keys in the hospital dataset."
        },
        "confidence": { "$ref": "#/$defs/confidence" },
        "source_excerpt": {
          "type": ["string", "null"],
          "maxLength": 500,
          "description": "Verbatim line from the policy document that this value came from. Required for any non-null cap_value: it is the audit trail that makes hallucination visible."
        }
      }
    }
  },

  "properties": {
    "schema_version": {
      "type": "string",
      "const": "1.0.0"
    },

    "policy_id": {
      "type": "string",
      "minLength": 1,
      "description": "Internal identifier assigned at upload time. Not the insurer's policy number."
    },

    "scheme_type": {
      "type": "string",
      "enum": ["retail_indemnity", "corporate_gmc", "government_scheme", "top_up"],
      "description": "Drives which UI path is shown. government_scheme (PM-JAY, ESI, Arogya Karnataka) is package-based rather than sum-insured-based and behaves differently throughout."
    },

    "insurer": {
      "type": "object",
      "additionalProperties": false,
      "required": ["name"],
      "properties": {
        "name": { "type": "string", "minLength": 1 },
        "policy_name": { "type": ["string", "null"] },
        "policy_number": {
          "type": ["string", "null"],
          "description": "Store masked (last 4 characters only). This is user PII and is never needed in full."
        }
      }
    },

    "coverage": {
      "type": "object",
      "additionalProperties": false,
      "required": ["sum_insured", "sum_insured_type"],
      "properties": {
        "sum_insured": {
          "type": ["number", "null"],
          "minimum": 0,
          "description": "Annual maximum in rupees. null for package-based government schemes with no single ceiling."
        },
        "sum_insured_type": {
          "type": "string",
          "enum": ["individual", "floater", "package_based"],
          "description": "floater means the limit is shared across all covered members."
        },
        "policy_period": {
          "type": ["object", "null"],
          "additionalProperties": false,
          "required": ["start", "end"],
          "properties": {
            "start": { "type": "string", "format": "date" },
            "end": { "type": "string", "format": "date" }
          }
        },
        "members_covered": { "type": ["integer", "null"], "minimum": 1 },
        "confidence": { "$ref": "#/$defs/confidence" }
      }
    },

    "room_rent": { "$ref": "#/$defs/capLimit" },
    "icu_rent": { "$ref": "#/$defs/capLimit" },

    "co_pay": {
      "type": "object",
      "additionalProperties": false,
      "required": ["percent", "applies_to", "confidence"],
      "properties": {
        "percent": {
          "type": "number",
          "minimum": 0,
          "maximum": 100,
          "description": "Share of the APPROVED amount the patient pays. Applied AFTER proportionate deduction, never before."
        },
        "applies_to": {
          "type": "string",
          "enum": ["all_claims", "non_network_only", "specific_ailments", "senior_citizen_only", "none"]
        },
        "confidence": { "$ref": "#/$defs/confidence" },
        "source_excerpt": { "type": ["string", "null"], "maxLength": 500 }
      }
    },

    "deductible": {
      "type": "object",
      "additionalProperties": false,
      "required": ["amount", "confidence"],
      "properties": {
        "amount": {
          "type": "number",
          "minimum": 0,
          "description": "Rupees the patient absorbs before the insurer pays anything. 0 for most retail policies."
        },
        "confidence": { "$ref": "#/$defs/confidence" }
      }
    },

    "sub_limits": {
      "type": "array",
      "description": "Per-category ceilings that override the sum insured for that category. Empty array is valid and common.",
      "items": {
        "type": "object",
        "additionalProperties": false,
        "required": ["category", "limit_amount", "basis", "confidence"],
        "properties": {
          "category": {
            "type": "string",
            "description": "Free text, but prefer a package_code from the hospital dataset where one matches (e.g. cataract_surgery_with_iol) so the two can be joined."
          },
          "limit_amount": { "type": "number", "minimum": 0 },
          "basis": {
            "type": "string",
            "enum": ["per_eye", "per_hospitalization", "per_policy_year", "per_day", "per_claim"]
          },
          "confidence": { "$ref": "#/$defs/confidence" },
          "source_excerpt": { "type": ["string", "null"], "maxLength": 500 }
        }
      }
    },

    "waiting_periods": {
      "type": "array",
      "items": {
        "type": "object",
        "additionalProperties": false,
        "required": ["category", "months", "confidence"],
        "properties": {
          "category": {
            "type": "string",
            "enum": [
              "initial_waiting",
              "pre_existing_conditions",
              "specific_ailments",
              "maternity",
              "other"
            ]
          },
          "months": { "type": "integer", "minimum": 0 },
          "label": {
            "type": ["string", "null"],
            "description": "Human-readable detail, needed when category is 'other' or 'specific_ailments'."
          },
          "confidence": { "$ref": "#/$defs/confidence" },
          "source_excerpt": { "type": ["string", "null"], "maxLength": 500 }
        }
      }
    },

    "exclusions": {
      "type": "array",
      "items": {
        "type": "object",
        "additionalProperties": false,
        "required": ["text", "confidence"],
        "properties": {
          "text": { "type": "string", "minLength": 1, "maxLength": 300 },
          "confidence": { "$ref": "#/$defs/confidence" }
        }
      }
    },

    "network": {
      "type": "object",
      "additionalProperties": false,
      "required": ["type", "insurer_key", "restricted_to_network"],
      "properties": {
        "type": {
          "type": "string",
          "enum": ["cashless_network", "reimbursement_only", "empanelled_scheme"]
        },
        "insurer_key": {
          "type": ["string", "null"],
          "enum": [
            "star_health", "hdfc_ergo", "icici_lombard", "niva_bupa",
            "care_health", "bajaj_allianz", "new_india_assurance", "tata_aig",
            "pmjay", "cghs", "esi", null
          ],
          "description": "MUST match a value used in the hospital dataset's empanelment block. This key is the join between a policy and the hospitals that accept it."
        },
        "restricted_to_network": {
          "type": "boolean",
          "description": "true means non-network hospitals are not covered at all, not merely reimbursed later."
        },
        "non_network_reimbursement_percent": {
          "type": ["number", "null"],
          "minimum": 0,
          "maximum": 100
        },
        "confidence": { "$ref": "#/$defs/confidence" }
      }
    },

    "proportionate_deduction": {
      "type": "object",
      "additionalProperties": false,
      "required": ["applicable", "scalable_component_percent", "exempt_categories"],
      "properties": {
        "applicable": {
          "type": "boolean",
          "description": "false when the policy waives proportionate deduction (an increasingly common selling point). If false, only the room charge difference is borne by the patient."
        },
        "scalable_component_percent": {
          "type": "number",
          "minimum": 0,
          "maximum": 100,
          "description": "Share of the bill that scales by the room-rent ratio. 70 is a defensible demo default; state the assumption in the UI."
        },
        "exempt_categories": {
          "type": "array",
          "items": {
            "type": "string",
            "enum": ["consumables", "medicines", "implants", "diagnostics", "ambulance"]
          },
          "description": "Reimbursed at actuals, never scaled by the ratio."
        },
        "confidence": { "$ref": "#/$defs/confidence" },
        "note": { "type": ["string", "null"], "maxLength": 300 }
      }
    },

    "extraction_meta": {
      "type": "object",
      "additionalProperties": false,
      "required": ["extracted_at", "model", "overall_confidence", "fields_needing_review"],
      "properties": {
        "extracted_at": { "type": "string", "format": "date-time" },
        "model": { "type": "string" },
        "overall_confidence": { "$ref": "#/$defs/confidence" },
        "fields_needing_review": {
          "type": "array",
          "items": { "type": "string" },
          "description": "Dotted paths of any field with low confidence, e.g. 'room_rent.cap_value'. Drives the verify-this banner in the UI."
        },
        "source_document": { "type": ["string", "null"] },
        "is_mock_data": {
          "type": "boolean",
          "default": true,
          "description": "Always true for this project. Reinforces that no real policy data is handled."
        }
      }
    }
  }
}
